title,email,category,reportStage,problemDate,time,text,image,agency,staffemail,processวินไม่ยอมรับลูกค้า,teekung@gmail.com,มอเตอร์ไซค์,"in queue",18/10/2565,02:42:00,"ชมพู|ประตูBTS|12|วินปฏิเสธลูกค้าไม่ยอมบริการให้",,กองยานพาหนะ,,พบพฤติกรรมไม่เหมาะสม,teekung@gmail.com,มอเตอร์ไซค์,"in queue",18/10/2565,02:49:55,"เขียว|บริเวณประตูพหล|7|เห็นกำลังเสพสารบางอย่างเลยอยากให้ตรวจสอบ",,กองยานพาหนะ,,วินหยาบคาย,teekung@gmail.com,มอเตอร์ไซค์,"in queue",18/10/2565,02:51:58,"เขียว|ตรงข้ามธนาคารกรุงศรี|8|พูดจาหยาบคายกับผู้ใช้บริการ",,กองยานพาหนะ,,เก็บเงินเยอะผิดจากปกติ,teekung@gmail.com,มอเตอร์ไซค์,"in queue",18/10/2565,03:02:24,"ชมพู|แถวๆหอสมุด|4|เก็บเงินเยอะจากเดิมที่เคยเก็บ10บาทแต่กลับถูกเก็บ20บาท",,กองยานพาหนะ,,ขับรถประมาท,teekung@gmail.com,มอเตอร์ไซค์,"in queue",18/10/2565,03:13:54,"เขียว|ไม่ทราบ|14|ขับรถประมาทไม่ดูถนนจนเฉี่ยวชนคนข้ามถนน",,กองยานพาหนะ,,คีย์บอร์ดพัง,teekung@gmail.com,อุปกรณ์ITเสียหาย,"in queue",18/10/2565,03:24:53,"ของห้องสมุด|ใกล้ๆบริเวณโรงหนังที่ชั้น3ของห้องสมุด","คีย์บอร์ดพัง_2022-10-18_1666038293291.png","หน่วยงานเทคโนโลยีและสารสนเทศ",,โปรเจกเตอร์เสีย,teekung@gmail.com,อุปกรณ์ITเสียหาย,"in queue",18/10/2565,03:29:29,วิทยาการคอมพิวเตอร์|708,"โปรเจกเตอร์เสีย_2022-10-18_1666038569041.png","หน่วยงานเทคโนโลยีและสารสนเทศ",,เน็ตช้า,teekung@gmail.com,อุปกรณ์ITเสียหาย,"in queue",18/10/2565,03:31:58,"บริเวณชั้น7และ8ตึกSC45|ไม่ทราบ","เน็ตช้า_2022-10-18_1666038718464.png","หน่วยงานเทคโนโลยีและสารสนเทศ",,คอมพัง,teekung@gmail.com,อุปกรณ์ITเสียหาย,"in queue",18/10/2565,03:34:02,ตึกSCL|ไม่ทราบ,"คอมพัง_2022-10-18_1666038842778.jpg","หน่วยงานเทคโนโลยีและสารสนเทศ",,เมาส์พัง,teekung@gmail.com,อุปกรณ์ITเสียหาย,"in queue",18/10/2565,03:41:30,"วิทยาการคอม|ห้อง708อาคารSC45","เมาส์พัง_2022-10-18_1666039290657.jpg","หน่วยงานเทคโนโลยีและสารสนเทศ",,ข่าวสารไม่ทั่วถึง,teekung@gmail.com,ระบบเครือข่าย,"in queue",18/10/2565,03:43:09,"มีการกระจายข่าวของมหาลัยหลายอย่างไม่ทั่วถึงทำให้ไม่ทราบและทำให้เสียโอกาส",,"หน่วยงานเทคโนโลยีและสารสนเทศ",,Webลงทะเบียนล่ม,teekung@gmail.com,ระบบเครือข่าย,"in queue",18/10/2565,03:44:13,"เว็บของMy ku ล่มทำให้ลงทะเบียนไม่ได้",,"หน่วยงานเทคโนโลยีและสารสนเทศ",,programรายงานมีบัค,teekung@gmail.com,ระบบเครือข่าย,"in queue",18/10/2565,03:46:03,"โปรแกรมแจ้งเรื่องร้องเรียนมีบัคกดเปลี่ยนรูปภาพไม่ได้",,"หน่วยงานเทคโนโลยีและสารสนเทศ",,ฐานข้อมูลของห้องสมุด,teekung@gmail.com,ระบบเครือข่าย,"in queue",18/10/2565,03:47:11,"ฐานข้อมูลของห้องสมุดมีข้อมูลไม่ครบถ้วนหลายๆอย่างหายไป",,"หน่วยงานเทคโนโลยีและสารสนเทศ",,เว็บคณะล่ม,teekung@gmail.com,ระบบเครือข่าย,"in queue",18/10/2565,03:49:41,เข้าเว็บคณะไม่ได้,,"หน่วยงานเทคโนโลยีและสารสนเทศ",,ที่จอดรถเต็ม,midoriya@gmail.com,สถานที่,"in queue",18/10/2565,01:42:16,"หน้าคณะวิทยาศาสตร์|ที่จอดรถน้อยเกินไป ไม่เพียงพอต่อบุคคลากร","ที่จอดรถเต็ม_2022-10-18_1666032136716.jpg","หน่วยงานสถานที่และสิ่งแวดล้อม",,โรงอาหารเล็กเกินไป,midoriya@gmail.com,สถานที่,"in queue",18/10/2565,01:47:28,"โรงอาหารคณะวิทยาศาสตร์|โรงอาหารมีความจุไม่เพียงพอต่อนิสิตนักศึกษา ทำให้นิสิตต้องไปกินที่โรงอาหารอื่น","โรงอาหารเล็กเกินไป_2022-10-18_1666032448818.png","หน่วยงานสถานที่และสิ่งแวดล้อม",,ถนนเป็นหลุม,midoriya@gmail.com,สถานที่,"in queue",18/10/2565,01:54:38,"ถนนบริเวณหน้าคณะวิทยาศาสตร์|ถนนบริเวณข้างหน้าคณะวิทยาศาสตร์ มีหลุมอยู่เป็นแหล่งๆ ทำให้รถที่สัญจรไปมาต้องคอยระมักระวัง","ถนนเป็นหลุม_2022-10-18_1666032878293.jpg","หน่วยงานสถานที่และสิ่งแวดล้อม",,ห้องน้ำใช้งานไม่ได้,midoriya@gmail.com,สถานที่,"in queue",18/10/2565,02:00:22,"ชั้น 7 คณะวิทยาศาสตร์|ห้องน้ำชำรุด และ ยังไม่มีการดำเนินการซ่อม","ห้องน้ำใช้งานไม่ได้_2022-10-18_1666033222882.jpg","หน่วยงานสถานที่และสิ่งแวดล้อม",,ห้องน้ำสกปรกในหอพักชาย,midoriya@gmail.com,สถานที่,"in queue",18/10/2565,02:04:29,"ห้องน้ำ ที่หอพักชาย|ห้องน้ำสกปรกมาก และ ยังไม่มีแม่บ้านหรือ เจ้าหน้าที่มาทำความสะอาด","ห้องน้ำสกปรกในหอพักชาย_2022-10-18_1666033469876.sapfv4","หน่วยงานสถานที่และสิ่งแวดล้อม",,"ค่า pm 2.5 สูง",midoriya@gmail.com,สิ่งแวดล้อม,"in queue",18/10/2565,02:17:39,"ในพื้นที่มีฝุ่นละอองเยอะจนเห็นได้ชัด และวัดค่า pm 2.5 ได้สูง  ส่งผลให้นิสิตไปภูมิแพ้กันเยอะ|บริเวณหน้าคณะวิศวะ","ค่า pm 2.5 สูง_2022-10-18_1666034259238.jpeg","หน่วยงานสถานที่และสิ่งแวดล้อม",,น้ำเน่าเสีย,midoriya@gmail.com,สิ่งแวดล้อม,"in queue",18/10/2565,02:21:49,"บ่อน้ำส่งกลิ่นเหม็นเน่า ทำให้นิสิตไม่กล้าเดินผ่าน|หน้าโรงอาหารคณะวิศวะ","น้ำเน่าเสีย_2022-10-18_1666034509711.jpg","หน่วยงานสถานที่และสิ่งแวดล้อม",,ขยะเกลื่อนตามฟุตบาท,midoriya@gmail.com,สิ่งแวดล้อม,"in queue",18/10/2565,02:25:37,"ฟุตบาทหน้าคณะวิทยาศาสตร์มีขยะถูกทิ้งไม่เป็นที่ เกลื่อนตามพื้น ดูสกปรก|ฟุตบาทหน้าคณะวิทยาศาสตร์","ขยะเกลื่อนตามฟุตบาท_2022-10-18_1666034737431.jpg","หน่วยงานสถานที่และสิ่งแวดล้อม",,น้ำท่วม,midoriya@gmail.com,สิ่งแวดล้อม,"in queue",18/10/2565,02:29:55,"บริเวณหน้าคณะวิทยาศาสตร์ มีเหตุการณ์น้ำท่วมขังอยู่บ่อยครั้ง และเป็นติดต่อกันมาหลายสัปดาห์|ถนนหน้าคณะวิทยาศาสตร์","น้ำท่วม_2022-10-18_1666034995911.jpg","หน่วยงานสถานที่และสิ่งแวดล้อม",,ต้นไม้แห้งตาย,midoriya@gmail.com,สิ่งแวดล้อม,"in queue",18/10/2565,02:35:14,"ต้นไม้บริเวณหลังตึกคณะวิทยาศาสตร์แห้งตายอยู่หลายต้น ไม่มีใครคอยดูแลรดน้ำมาหลายวันแล้ว|หลังตึกคณะวิทยาศาตร์ 45 ปี","ต้นไม้แห้งตาย_2022-10-18_1666035314702.jpg","หน่วยงานสถานที่และสิ่งแวดล้อม",,ลูกบาสพัง,midoriya@gmail.com,อุปกรณ์กีฬาเสียหาย,"in queue",18/10/2565,02:47:59,"ลูกบาส จาก ศูนย์กีฬา","ลูกบาสพัง_2022-10-18_1666036079454.jpg",สำนักการกีฬา,,โต๊ะปิงปองพัง,midoriya@gmail.com,อุปกรณ์กีฬาเสียหาย,"in queue",18/10/2565,02:51:26,"โต็ะปองใต้อาคารอาคารจักรพันธ์เพ็ญศิริ","โต๊ะปิงปองพัง_2022-10-18_1666036286523.jpg",สำนักการกีฬา,,เน็ตขาด,midoriya@gmail.com,อุปกรณ์กีฬาเสียหาย,"in queue",18/10/2565,02:56:21,เน็ตในสนามเทนนิส,"เน็ตขาด_2022-10-18_1666036581317.jpg",สำนักการกีฬา,,ลูกบอลรั่ว,midoriya@gmail.com,อุปกรณ์กีฬาเสียหาย,"in queue",18/10/2565,03:05:23,ลูกบอลจากศูนย์กีฬา,"ลูกบอลรั่ว_2022-10-18_1666037123403.jpg",สำนักการกีฬา,,แป้นบาสพัง,midoriya@gmail.com,อุปกรณ์กีฬาเสียหาย,"in queue",18/10/2565,03:08:36,"แป้นบาส ที่ศูนย์กีฬา","แป้นบาสพัง_2022-10-18_1666037316580.jpg",สำนักการกีฬา,,รถชน,milize@gmail.com,อุบัติเหตุ,"in queue",18/10/2565,04:15:17,ถนนหน้าตึกคณะวิทย์,"รถชน_2022-10-18_1666041317785.jpg","สถานพยาบาล มก.",,จักรยานยนต์ล่ม,milize@gmail.com,อุบัติเหตุ,"in queue",18/10/2565,04:17:42,หน้าศูนย์กีฬา,"จักรยานยนต์ล่ม_2022-10-18_1666041462162.jpg","สถานพยาบาล มก.",,กระบถหลุดโค้ง,milize@gmail.com,อุบัติเหตุ,"in queue",18/10/2565,04:21:37,หน้าคณะวิศวะ,"กระบถหลุดโค้ง_2022-10-18_1666041697665.jpg","สถานพยาบาล มก.",,ตกท่อ,milize@gmail.com,อุบัติเหตุ,"in queue",18/10/2565,04:26:36,หน้าศร.3,"ตกท่อ_2022-10-18_1666041996240.jpg","สถานพยาบาล มก.",,ชนตัวเงินตัวทอง,milize@gmail.com,อุบัติเหตุ,"in queue",18/10/2565,04:31:30,"บริเวณLoving way","ชนตัวเงินตัวทอง_2022-10-18_1666042290369.jpg","สถานพยาบาล มก.",,ตารางเรียนชนกัน,milize@gmail.com,การเรียนการสอน,"in queue",18/10/2565,04:36:38,"สแตทชนกับแคลวันพฤหัสช่วงเที่ยง|แคลคูลัส สแตท|อาจารย์กันตภณ ประxxxx และ อาจารย์จุฑาภรณ์ xxxxxx",,ฝ่ายวิชาการและแผนงาน,,ไม่สามารถติดต่อที่ปรึกษา,milize@gmail.com,การเรียนการสอน,"in queue",18/10/2565,04:38:26,"ไม่สามารถติดต่อที่ปรึกษาได้เลยสักช่องทาง|-----|อาจารย์สุริษา",,ฝ่ายวิชาการและแผนงาน,,งานเยอะเกินจำเป็น,milize@gmail.com,การเรียนการสอน,"in queue",18/10/2565,04:40:55,"มีงานจากหลายวิชามาพร้อมๆกันมากเกินไป|Plants for Value of Life Creation สแตท|อาจารย์พุฐิพง อาจารย์ธนดล",,ฝ่ายวิชาการและแผนงาน,,เสียงการเรียนไม่ชัด,milize@gmail.com,การเรียนการสอน,"in queue",18/10/2565,04:43:05,"ตอนเรียนออนไลน์เสียงมีความไม่ชัดเจน|Radiation, Life and Environment|อาจารย์จิรภัทร",,ฝ่ายวิชาการและแผนงาน,,เวลาเรียนไม่เหมาะสม,milize@gmail.com,การเรียนการสอน,"in queue",18/10/2565,04:48:00,"ช่วงว่างระหว่างวันมากเกินไป เช่น เรียนเริ่ม 8โมงแต่เลิก 6โมงเย็นทั้งที่ช่วงระหว่างวันหว่างทั้งวัน|จาวาและData structure (เรื่องสมมุตินะครับ)|อาจารย์รัชพล อาจารย์หินซุย",,ฝ่ายวิชาการและแผนงาน,,นิสิตตีกัน,milize@gmail.com,ความรุนแรง,"in queue",18/10/2565,04:50:19,"นิสิตคณะวิทย์ไล่ตีกันด้วยคีย์บอร์ด|ตึกSC45|ไม่ทราบ",,หน่วยงานรักษาความปลอดภัย,,นักเรียนคณะวิทย์ตบกัน,milize@gmail.com,ความรุนแรง,"in queue",18/10/2565,04:53:35,"มีนักศึกษาหญิงตบกัน|SC45|คาดว่าเป็นสาขาวิทย์คอม",,หน่วยงานรักษาความปลอดภัย,,วินมอไซต์ตีกัน,milize@gmail.com,ความรุนแรง,"in queue",18/10/2565,04:54:59,"วิทเสื้อชทพูและเขียวตีกันแย่งลูกค้า|ทางออกBTS|ไม่ทราบ",,หน่วยงานรักษาความปลอดภัย,,พบคนทารุณสัตว์,milize@gmail.com,ความรุนแรง,"in queue",18/10/2565,04:56:52,"มีคนเอาไม้ไล่ตีตัวเงินตัวทอง|ระหว่างทางเดินไปบาร์ใหม่แถวๆหน้าคณะวิสวะ|ไม่มี",,หน่วยงานรักษาความปลอดภัย,,"พบคนเอาหนังสติ๊กมายิงสัตว์",milize@gmail.com,ความรุนแรง,"in queue",18/10/2565,04:58:50,"เห็นคนเอาหนังสติ๊กมายิงกระรอกและนกในมหาลัย|แถวคณะเกษตร|ไม่มี",,หน่วยงานรักษาความปลอดภัย,,