title,email,category,reportStage,problemDate,time,text,image,agency,staffemail,process"เด็กเอาคีย์บอร์ดไล่ตีกันในคณะวิทยาศาสตร์",Ratchaphon111@gmail.com,อุปกรณ์,finish,09/10/2022,02:25:11,คีย์บอร์ด,"เด็กเอาคีย์บอร์ดไล่ตีกันในคณะวิทยาศาสตร์_2022-10-09_1665257111080.jpg","สำนักบริการคอมพิวเตอร์ มหาวิทยาลัย",Ratchanon,"สายไฟไม่พอใช้ ที่ห้องสมุดวิทยาการคอมพิวเตอร์",Ratchaphon111@gmail.com,อุปกรณ์,finich,09/10/2022,02:39:17,สายไฟ,"สายไฟไม่พอใช้ ที่ห้องสมุดวิทยาการคอมพิวเตอร์_2022-10-09_1665257957422.jpg","สำนักบริการคอมพิวเตอร์ มหาวิทยาลัย",Ratchanon,ทำแล้วคอมระเบิด,Ratchanon111@gmail.com,อุปกรณ์,"in progress",09/10/2022,09:12:02,ห้องคอมระเบิด,"คอมระเบิด_2022-10-09_1665324722973.jpg","สำนักบริการคอมพิวเตอร์ มหาวิทยาลัย",,น้ำท่วม,test1,อาคารเสียหาย,"in progress",10/10/2022,03:04:44,"หน้าคณะวิทย์|ฟุตบาทมีน้ำขัง","น้ำท่วม_2022-10-10_1665389084541.jpg",อาคารและสถานที่,,อาคารถล่ม,"sevenknight5570@gmail.com",อาคารเสียหาย,"in queue",15/10/2022,05:01:09,คณะวิทยาศาสตร์|อาคาร,"อาคารถล่ม_2022-10-15_1665828069041.png",อาคารและสถานที่,,asdasdasd,"sevenknight5570@gmail.com",อาคารเสียหาย,"in queue",16/10/2022,01:17:38,asdasda|sdasdasdasd,"asdasdasd_2022-10-16_1665857858462.png",อาคารและสถานที่,,